[
    {
        "id": 1,
        "name": "Water Dragon",
        "element": 1,
        "rarity": 5,
        "max_level": 99,
        "base_hp": 800,
        "base_atk": 350,
        "base_rec": 150,
        "max_hp": 3200,
        "max_atk": 1400,
        "max_rec": 350,
        "cost": 25,
        "active_skill_id": 1,
        "leader_skill_id": 1,
        "evolve_to": 11,
        "evolve_materials": [101, 102],
        "exp_curve": "standard"
    },
    {
        "id": 2,
        "name": "Fire Phoenix",
        "element": 2,
        "rarity": 5,
        "max_level": 99,
        "base_hp": 750,
        "base_atk": 400,
        "base_rec": 130,
        "max_hp": 3000,
        "max_atk": 1600,
        "max_rec": 300,
        "cost": 25,
        "active_skill_id": 2,
        "leader_skill_id": 2,
        "evolve_to": 12,
        "evolve_materials": [101, 103],
        "exp_curve": "standard"
    },
    {
        "id": 3,
        "name": "Earth Golem",
        "element": 3,
        "rarity": 5,
        "max_level": 99,
        "base_hp": 950,
        "base_atk": 300,
        "base_rec": 120,
        "max_hp": 3800,
        "max_atk": 1200,
        "max_rec": 280,
        "cost": 25,
        "active_skill_id": 3,
        "leader_skill_id": 3,
        "evolve_to": 13,
        "evolve_materials": [102, 103],
        "exp_curve": "standard"
    },
    {
        "id": 4,
        "name": "Light Angel",
        "element": 4,
        "rarity": 5,
        "max_level": 99,
        "base_hp": 820,
        "base_atk": 330,
        "base_rec": 200,
        "max_hp": 3300,
        "max_atk": 1320,
        "max_rec": 450,
        "cost": 25,
        "active_skill_id": 4,
        "leader_skill_id": 4,
        "evolve_to": 14,
        "evolve_materials": [101, 102, 103],
        "exp_curve": "standard"
    },
    {
        "id": 5,
        "name": "Dark Reaper",
        "element": 5,
        "rarity": 5,
        "max_level": 99,
        "base_hp": 780,
        "base_atk": 420,
        "base_rec": 100,
        "max_hp": 3100,
        "max_atk": 1680,
        "max_rec": 250,
        "cost": 25,
        "active_skill_id": 5,
        "leader_skill_id": 5,
        "evolve_to": 15,
        "evolve_materials": [101, 103],
        "exp_curve": "standard"
    },
    {
        "id": 6,
        "name": "Aqua Knight",
        "element": 1,
        "rarity": 4,
        "max_level": 70,
        "base_hp": 550,
        "base_atk": 230,
        "base_rec": 100,
        "max_hp": 2000,
        "max_atk": 900,
        "max_rec": 220,
        "cost": 15,
        "active_skill_id": 6,
        "leader_skill_id": null,
        "evolve_to": null,
        "evolve_materials": [],
        "exp_curve": "standard"
    },
    {
        "id": 7,
        "name": "Flame Warrior",
        "element": 2,
        "rarity": 4,
        "max_level": 70,
        "base_hp": 500,
        "base_atk": 270,
        "base_rec": 90,
        "max_hp": 1850,
        "max_atk": 1050,
        "max_rec": 200,
        "cost": 15,
        "active_skill_id": 7,
        "leader_skill_id": null,
        "evolve_to": null,
        "evolve_materials": [],
        "exp_curve": "standard"
    },
    {
        "id": 8,
        "name": "Forest Guardian",
        "element": 3,
        "rarity": 4,
        "max_level": 70,
        "base_hp": 620,
        "base_atk": 200,
        "base_rec": 85,
        "max_hp": 2300,
        "max_atk": 780,
        "max_rec": 190,
        "cost": 15,
        "active_skill_id": 8,
        "leader_skill_id": null,
        "evolve_to": null,
        "evolve_materials": [],
        "exp_curve": "standard"
    },
    {
        "id": 9,
        "name": "Holy Paladin",
        "element": 4,
        "rarity": 4,
        "max_level": 70,
        "base_hp": 560,
        "base_atk": 220,
        "base_rec": 140,
        "max_hp": 2050,
        "max_atk": 860,
        "max_rec": 310,
        "cost": 15,
        "active_skill_id": 9,
        "leader_skill_id": null,
        "evolve_to": null,
        "evolve_materials": [],
        "exp_curve": "standard"
    },
    {
        "id": 10,
        "name": "Shadow Assassin",
        "element": 5,
        "rarity": 4,
        "max_level": 70,
        "base_hp": 480,
        "base_atk": 290,
        "base_rec": 75,
        "max_hp": 1800,
        "max_atk": 1120,
        "max_rec": 170,
        "cost": 15,
        "active_skill_id": 10,
        "leader_skill_id": null,
        "evolve_to": null,
        "evolve_materials": [],
        "exp_curve": "standard"
    },
    {
        "id": 11,
        "name": "Abyssal Sea Dragon",
        "element": 1,
        "rarity": 6,
        "max_level": 99,
        "base_hp": 1200,
        "base_atk": 520,
        "base_rec": 200,
        "max_hp": 4500,
        "max_atk": 2000,
        "max_rec": 480,
        "cost": 35,
        "active_skill_id": 1,
        "leader_skill_id": 1,
        "evolve_to": null,
        "evolve_materials": [],
        "exp_curve": "advanced"
    },
    {
        "id": 12,
        "name": "Inferno Phoenix",
        "element": 2,
        "rarity": 6,
        "max_level": 99,
        "base_hp": 1100,
        "base_atk": 600,
        "base_rec": 180,
        "max_hp": 4200,
        "max_atk": 2300,
        "max_rec": 420,
        "cost": 35,
        "active_skill_id": 2,
        "leader_skill_id": 2,
        "evolve_to": null,
        "evolve_materials": [],
        "exp_curve": "advanced"
    },
    {
        "id": 13,
        "name": "Ancient Earth Titan",
        "element": 3,
        "rarity": 6,
        "max_level": 99,
        "base_hp": 1400,
        "base_atk": 450,
        "base_rec": 160,
        "max_hp": 5200,
        "max_atk": 1750,
        "max_rec": 380,
        "cost": 35,
        "active_skill_id": 3,
        "leader_skill_id": 3,
        "evolve_to": null,
        "evolve_materials": [],
        "exp_curve": "advanced"
    },
    {
        "id": 14,
        "name": "Archangel of Dawn",
        "element": 4,
        "rarity": 6,
        "max_level": 99,
        "base_hp": 1250,
        "base_atk": 500,
        "base_rec": 280,
        "max_hp": 4700,
        "max_atk": 1900,
        "max_rec": 620,
        "cost": 35,
        "active_skill_id": 4,
        "leader_skill_id": 4,
        "evolve_to": null,
        "evolve_materials": [],
        "exp_curve": "advanced"
    },
    {
        "id": 15,
        "name": "Grim Harvester",
        "element": 5,
        "rarity": 6,
        "max_level": 99,
        "base_hp": 1150,
        "base_atk": 630,
        "base_rec": 140,
        "max_hp": 4300,
        "max_atk": 2400,
        "max_rec": 340,
        "cost": 35,
        "active_skill_id": 5,
        "leader_skill_id": 5,
        "evolve_to": null,
        "evolve_materials": [],
        "exp_curve": "advanced"
    },
    {
        "id": 16,
        "name": "Water Sprite",
        "element": 1,
        "rarity": 3,
        "max_level": 50,
        "base_hp": 350,
        "base_atk": 150,
        "base_rec": 70,
        "max_hp": 1100,
        "max_atk": 500,
        "max_rec": 150,
        "cost": 8,
        "active_skill_id": 6,
        "leader_skill_id": null,
        "evolve_to": null,
        "evolve_materials": [],
        "exp_curve": "fast"
    },
    {
        "id": 17,
        "name": "Fire Imp",
        "element": 2,
        "rarity": 3,
        "max_level": 50,
        "base_hp": 320,
        "base_atk": 170,
        "base_rec": 60,
        "max_hp": 1000,
        "max_atk": 560,
        "max_rec": 130,
        "cost": 8,
        "active_skill_id": 7,
        "leader_skill_id": null,
        "evolve_to": null,
        "evolve_materials": [],
        "exp_curve": "fast"
    },
    {
        "id": 18,
        "name": "Moss Turtle",
        "element": 3,
        "rarity": 3,
        "max_level": 50,
        "base_hp": 400,
        "base_atk": 130,
        "base_rec": 65,
        "max_hp": 1300,
        "max_atk": 430,
        "max_rec": 140,
        "cost": 8,
        "active_skill_id": 8,
        "leader_skill_id": null,
        "evolve_to": null,
        "evolve_materials": [],
        "exp_curve": "fast"
    },
    {
        "id": 19,
        "name": "Light Wisp",
        "element": 4,
        "rarity": 3,
        "max_level": 50,
        "base_hp": 340,
        "base_atk": 140,
        "base_rec": 90,
        "max_hp": 1050,
        "max_atk": 470,
        "max_rec": 200,
        "cost": 8,
        "active_skill_id": 9,
        "leader_skill_id": null,
        "evolve_to": null,
        "evolve_materials": [],
        "exp_curve": "fast"
    },
    {
        "id": 20,
        "name": "Dark Bat",
        "element": 5,
        "rarity": 3,
        "max_level": 50,
        "base_hp": 300,
        "base_atk": 180,
        "base_rec": 55,
        "max_hp": 950,
        "max_atk": 600,
        "max_rec": 120,
        "cost": 8,
        "active_skill_id": 10,
        "leader_skill_id": null,
        "evolve_to": null,
        "evolve_materials": [],
        "exp_curve": "fast"
    },
    {
        "id": 101,
        "name": "Elemental Shard",
        "element": 6,
        "rarity": 1,
        "max_level": 1,
        "base_hp": 50,
        "base_atk": 10,
        "base_rec": 10,
        "max_hp": 50,
        "max_atk": 10,
        "max_rec": 10,
        "cost": 1,
        "active_skill_id": null,
        "leader_skill_id": null,
        "evolve_to": null,
        "evolve_materials": [],
        "exp_curve": "flat"
    },
    {
        "id": 102,
        "name": "Dragon Scale",
        "element": 6,
        "rarity": 2,
        "max_level": 1,
        "base_hp": 80,
        "base_atk": 20,
        "base_rec": 15,
        "max_hp": 80,
        "max_atk": 20,
        "max_rec": 15,
        "cost": 2,
        "active_skill_id": null,
        "leader_skill_id": null,
        "evolve_to": null,
        "evolve_materials": [],
        "exp_curve": "flat"
    },
    {
        "id": 103,
        "name": "Phoenix Feather",
        "element": 6,